region,zone_ugc,same_code,name,lon,lat,operational,source_url
GM,GMZ232,077232,Corpus Christi and Nueces Bays,-97.2759,27.7758,true,https://www.weather.gov/source/gis/Shapefiles/WSOM/mareas20fe25.txt
GM,GMZ236,077236,"Copano, Aransas, and Redfish Bays",-97.0437,28.0506,true,https://www.weather.gov/source/gis/Shapefiles/WSOM/mareas20fe25.txt
GM,GMZ237,077237,"San Antonio, Mesquite, and Espiritu Santo Bays",-96.6757,28.304,true,https://www.weather.gov/source/gis/Shapefiles/WSOM/mareas20fe25.txt
GM,GMZ250,077250,Coastal waters from Baffin Bay to Port Aransas out 20 NM,-97.0483,27.4999,true,https://www.weather.gov/source/gis/Shapefiles/WSOM/mareas20fe25.txt
GM,GMZ255,077255,Coastal waters from Port Aransas to Matagorda Ship Channel out 20 NM,-96.579,28.0267,true,https://www.weather.gov/source/gis/Shapefiles/WSOM/mareas20fe25.txt
GM,GMZ270,077270,Waters from Baffin Bay to Port Aransas from 20 to 60 NM,-96.5212,27.3393,true,https://www.weather.gov/source/gis/Shapefiles/WSOM/mareas20fe25.txt
GM,GMZ275,077275,Waters from Port Aransas to Matagorda Ship Channel from 20 to 60 NM,-96.1165,27.7184,true,https://www.weather.gov/source/gis/Shapefiles/WSOM/mareas20fe25.txt
GM,GMZ330,077330,Matagorda Bay,-96.2752,28.5978,true,https://www.weather.gov/source/gis/Shapefiles/WSOM/mareas20fe25.txt
GM,GMZ335,077335,Galveston Bay,-94.859,29.4906,true,https://www.weather.gov/source/gis/Shapefiles/WSOM/mareas20fe25.txt
GM,GMZ350,077350,Coastal waters from Freeport to Matagorda Ship Channel TX out 20 NM,-95.7344,28.5222,true,https://www.weather.gov/source/gis/Shapefiles/WSOM/mareas20fe25.txt
GM,GMZ355,077355,Coastal waters from High Island to Freeport TX out 20 NM,-94.7826,29.0957,true,https://www.weather.gov/source/gis/Shapefiles/WSOM/mareas20fe25.txt
GM,GMZ370,077370,Waters from Freeport to Matagorda Ship Channel TX from 20 to 60 NM,-95.3941,28.12,true,https://www.weather.gov/source/gis/Shapefiles/WSOM/mareas20fe25.txt
GM,GMZ375,077375,Waters from High Island to Freeport TX from 20 to 60 NM,-94.5463,28.6213,true,https://www.weather.gov/source/gis/Shapefiles/WSOM/mareas20fe25.txt
GM,GMZ430,077430,Sabine Lake,-93.8494,29.8774,true,https://www.weather.gov/source/gis/Shapefiles/WSOM/mareas20fe25.txt
GM,GMZ432,077432,Calcasieu Lake,-93.3138,29.9138,true,https://www.weather.gov/source/gis/Shapefiles/WSOM/mareas20fe25.txt
GM,GMZ435,077435,Vermilion and West Cote Blanche Bay,-91.8965,29.6969,true,https://www.weather.gov/source/gis/Shapefiles/WSOM/mareas20fe25.txt
GM,GMZ436,077436,Atchafalaya and East Cote Blanche,-91.4697,29.4748,true,https://www.weather.gov/source/gis/Shapefiles/WSOM/mareas20fe25.txt
GM,GMZ450,077450,Coastal waters from Cameron LA to High Island TX out 20 NM,-93.8353,29.5254,true,https://www.weather.gov/source/gis/Shapefiles/WSOM/mareas20fe25.txt
GM,GMZ452,077452,Coastal waters from Intracoastal City to Cameron LA out 20 NM,-92.7446,29.4677,true,https://www.weather.gov/source/gis/Shapefiles/WSOM/mareas20fe25.txt
GM,GMZ455,077455,Coastal waters from Lower Atchafalaya River to Intracoastal City LA out 20 NM,-91.669,29.2898,true,https://www.weather.gov/source/gis/Shapefiles/WSOM/mareas20fe25.txt
GM,GMZ470,077470,Waters from Cameron LA to High Island TX from 20 to 60 NM,-93.7511,29.0293,true,https://www.weather.gov/source/gis/Shapefiles/WSOM/mareas20fe25.txt
GM,GMZ472,077472,Waters from Intracoastal City to Cameron LA from 20 to 60 NM,-92.7477,28.9422,true,https://www.weather.gov/source/gis/Shapefiles/WSOM/mareas20fe25.txt
GM,GMZ475,077475,Waters from Lower Atchafalaya River to Intracoastal City LA from 20 to 60 NM,-91.7011,28.6577,true,https://www.weather.gov/source/gis/Shapefiles/WSOM/mareas20fe25.txt
GM,GMZ530,077530,Lake Pontchartrain and Lake Maurepas,-90.1731,30.1924,true,https://www.weather.gov/source/gis/Shapefiles/WSOM/mareas20fe25.txt
GM,GMZ532,077532,Mississippi Sound,-88.9966,30.2571,true,https://www.weather.gov/source/gis/Shapefiles/WSOM/mareas20fe25.txt
GM,GMZ534,077534,Lake Borgne,-89.6555,30.019,true,https://www.weather.gov/source/gis/Shapefiles/WSOM/mareas20fe25.txt
GM,GMZ536,077536,Chandeleur Sound,-89.0805,29.929,true,https://www.weather.gov/source/gis/Shapefiles/WSOM/mareas20fe25.txt
GM,GMZ538,077538,Breton Sound,-89.3914,29.579,true,https://www.weather.gov/source/gis/Shapefiles/WSOM/mareas20fe25.txt
GM,GMZ550,077550,Coastal Waters from Port Fourchon LA to Lower Atchafalaya River LA out 20 nm,-90.7078,28.9745,true,https://www.weather.gov/source/gis/Shapefiles/WSOM/mareas20fe25.txt
GM,GMZ552,077552,Coastal waters from the Southwest Pass of the Mississippi River to Port Fourchon Louisiana out 20 NM,-89.7238,29.0066,true,https://www.weather.gov/source/gis/Shapefiles/WSOM/mareas20fe25.txt
GM,GMZ555,077555,Coastal Waters from Boothville LA to Southwest Pass of the Mississippi River out 20 nm,-88.9907,29.09,true,https://www.weather.gov/source/gis/Shapefiles/WSOM/mareas20fe25.txt
GM,GMZ557,077557,Coastal waters from Pascagoula Mississippi to Stake Island out 20 NM,-88.6479,29.8477,true,https://www.weather.gov/source/gis/Shapefiles/WSOM/mareas20fe25.txt
GM,GMZ570,077570,Coastal waters from Port Fourchon Louisiana to Lower Atchafalaya River LA from 20 to 60 NM,-90.6892,28.3837,true,https://www.weather.gov/source/gis/Shapefiles/WSOM/mareas20fe25.txt
GM,GMZ572,077572,Coastal waters from Southwest Pass of the Mississippi River to Port Fourchon Louisiana from 20 to 60 NM,-89.6368,28.3369,true,https://www.weather.gov/source/gis/Shapefiles/WSOM/mareas20fe25.txt
GM,GMZ575,077575,Coastal Waters from Stake Island LA to Southwest Pass of the Mississippi River from 20 to 60 nm,-88.6801,28.4941,true,https://www.weather.gov/source/gis/Shapefiles/WSOM/mareas20fe25.txt
GM,GMZ577,077577,Coastal waters from Pascagoula Mississippi to Stake Island Louisiana out 20 to 60 NM,-88.2723,29.2288,true,https://www.weather.gov/source/gis/Shapefiles/WSOM/mareas20fe25.txt
GM,GMZ630,077630,North Mobile Bay,-87.995,30.5986,true,https://www.weather.gov/source/gis/Shapefiles/WSOM/mareas20fe25.txt
GM,GMZ631,077631,South Mobile Bay,-87.9632,30.3382,true,https://www.weather.gov/source/gis/Shapefiles/WSOM/mareas20fe25.txt
GM,GMZ632,077632,Mississippi Sound,-88.28,30.3077,true,https://www.weather.gov/source/gis/Shapefiles/WSOM/mareas20fe25.txt
GM,GMZ633,077633,Perdido Bay Area,-87.4785,30.3472,true,https://www.weather.gov/source/gis/Shapefiles/WSOM/mareas20fe25.txt
GM,GMZ634,077634,Pensacola Bay Area including Santa Rosa Sound,-87.0807,30.4299,true,https://www.weather.gov/source/gis/Shapefiles/WSOM/mareas20fe25.txt
GM,GMZ635,077635,Western Choctawhatchee Bay,-86.4883,30.4368,true,https://www.weather.gov/source/gis/Shapefiles/WSOM/mareas20fe25.txt
GM,GMZ636,077636,Eastern Choctawhatchee Bay,-86.2572,30.4308,true,https://www.weather.gov/source/gis/Shapefiles/WSOM/mareas20fe25.txt
GM,GMZ650,077650,Coastal waters from Pensacola FL to Pascagoula MS out 20 NM,-87.7804,30.0849,true,https://www.weather.gov/source/gis/Shapefiles/WSOM/mareas20fe25.txt
GM,GMZ655,077655,Coastal waters from Okaloosa-Walton County Line to Pensacola FL out 20 NM,-86.7986,30.2046,true,https://www.weather.gov/source/gis/Shapefiles/WSOM/mareas20fe25.txt
GM,GMZ656,077656,Coastal waters from Chokoloskee to Bonita Beach FL out 20 NM,-81.8725,25.9537,true,https://www.weather.gov/source/gis/Shapefiles/WSOM/mareas20fe25.txt
GM,GMZ657,077657,Coastal waters from East Cape Sable to Chokoloskee FL out 20 NM,-81.3895,25.4537,true,https://www.weather.gov/source/gis/Shapefiles/WSOM/mareas20fe25.txt
GM,GMZ670,077670,Waters from Pensacola FL to Pascagoula MS from 20 to 60 NM,-87.649,29.6053,true,https://www.weather.gov/source/gis/Shapefiles/WSOM/mareas20fe25.txt
GM,GMZ675,077675,Waters from Okaloosa-Walton County Line to Pensacola FL from 20 to 60 NM,-86.7724,29.6996,true,https://www.weather.gov/source/gis/Shapefiles/WSOM/mareas20fe25.txt
GM,GMZ676,077676,Waters from Chokoloskee to Bonita Beach FL from 20 to 60 NM,-82.4195,25.814,true,https://www.weather.gov/source/gis/Shapefiles/WSOM/mareas20fe25.txt
GM,GMZ730,077730,Apalachee Bay or Coastal Waters From Keaton Beach to Ochlockonee River Fl out to 20 Nm,-84.0258,29.924,true,https://www.weather.gov/source/gis/Shapefiles/WSOM/mareas20fe25.txt
GM,GMZ750,077750,Coastal waters from Okaloosa-Walton County Line to Mexico Beach out 20 NM,-85.8786,29.992,true,https://www.weather.gov/source/gis/Shapefiles/WSOM/mareas20fe25.txt
GM,GMZ752,077752,Coastal Waters from Mexico Beach to Apalachicola out 20 NM,-85.2672,29.5259,true,https://www.weather.gov/source/gis/Shapefiles/WSOM/mareas20fe25.txt
GM,GMZ755,077755,Coastal Waters From Ochlockonee River to Apalachicola FL out to 20 Nm,-84.5921,29.6249,true,https://www.weather.gov/source/gis/Shapefiles/WSOM/mareas20fe25.txt
GM,GMZ765,077765,Coastal waters from Suwannee River to Keaton Beach out 20 NM,-83.5692,29.511,true,https://www.weather.gov/source/gis/Shapefiles/WSOM/mareas20fe25.txt
GM,GMZ770,077770,Waters from Okaloosa-Walton County Line to Mexico Beach from 20 to 60 NM,-86.0728,29.4457,true,https://www.weather.gov/source/gis/Shapefiles/WSOM/mareas20fe25.txt
GM,GMZ772,077772,Waters from Mexico Beach to Apalachicola FL from 20 to 60 NM,-85.3908,28.9776,true,https://www.weather.gov/source/gis/Shapefiles/WSOM/mareas20fe25.txt
GM,GMZ775,077775,Waters from Suwannee River to Apalachicola FL from 20 to 60 NM,-84.3301,29.1409,true,https://www.weather.gov/source/gis/Shapefiles/WSOM/mareas20fe25.txt
GM,GMZ830,077830,Tampa Bay waters,-82.5957,27.7549,true,https://www.weather.gov/source/gis/Shapefiles/WSOM/mareas20fe25.txt
GM,GMZ836,077836,Charlotte Harbor and Pine Island Sound,-82.1377,26.7015,true,https://www.weather.gov/source/gis/Shapefiles/WSOM/mareas20fe25.txt
GM,GMZ850,077850,Coastal waters from Tarpon Springs to Suwannee River FL out 20 NM,-82.9871,28.7523,true,https://www.weather.gov/source/gis/Shapefiles/WSOM/mareas20fe25.txt
GM,GMZ853,077853,Coastal waters from Englewood to Tarpon Springs FL out 20 NM,-82.8412,27.5196,true,https://www.weather.gov/source/gis/Shapefiles/WSOM/mareas20fe25.txt
GM,GMZ856,077856,Coastal waters from Bonita Beach to Englewood FL out 20 NM,-82.3273,26.5365,true,https://www.weather.gov/source/gis/Shapefiles/WSOM/mareas20fe25.txt
GM,GMZ870,077870,Waters from Tarpon Springs to Suwannee River FL out 20 to 60 NM,-83.5014,28.6012,true,https://www.weather.gov/source/gis/Shapefiles/WSOM/mareas20fe25.txt
GM,GMZ873,077873,Waters from Englewood to Tarpon Springs FL out 20 to 60 NM,-83.3173,27.4363,true,https://www.weather.gov/source/gis/Shapefiles/WSOM/mareas20fe25.txt
GM,GMZ876,077876,Waters from Bonita Beach to Englewood FL out 20 to 60 NM,-82.8243,26.4245,true,https://www.weather.gov/source/gis/Shapefiles/WSOM/mareas20fe25.txt
LS,LSZ121,091121,Chequamegon Bay-Bayfield to Oak Point WI,-90.8344,46.6872,true,https://www.weather.gov/source/gis/Shapefiles/WSOM/mareas20fe25.txt
LS,LSZ140,091140,Grand Portage to Grand Marais MN,-89.8617,47.8383,true,https://www.weather.gov/source/gis/Shapefiles/WSOM/mareas20fe25.txt
LS,LSZ141,091141,Grand Marais to Taconite Harbor MN,-90.6125,47.6181,true,https://www.weather.gov/source/gis/Shapefiles/WSOM/mareas20fe25.txt
LS,LSZ142,091142,Taconite Harbor to Silver Bay Harbor MN,-91.0666,47.3801,true,https://www.weather.gov/source/gis/Shapefiles/WSOM/mareas20fe25.txt
LS,LSZ143,091143,Silver Bay Harbor to Two Harbors MN,-91.4217,47.123,true,https://www.weather.gov/source/gis/Shapefiles/WSOM/mareas20fe25.txt
LS,LSZ144,091144,Two Harbors to Duluth MN,-91.8212,46.8869,true,https://www.weather.gov/source/gis/Shapefiles/WSOM/mareas20fe25.txt
LS,LSZ145,091145,Duluth MN to Port Wing WI,-91.7728,46.7595,true,https://www.weather.gov/source/gis/Shapefiles/WSOM/mareas20fe25.txt
LS,LSZ146,091146,Port Wing to Sand Island WI,-91.1889,46.9057,true,https://www.weather.gov/source/gis/Shapefiles/WSOM/mareas20fe25.txt
LS,LSZ147,091147,Sand Island to Bayfield WI,-90.8,46.9382,true,https://www.weather.gov/source/gis/Shapefiles/WSOM/mareas20fe25.txt
LS,LSZ148,091148,Oak Point to Saxon Harbor WI,-90.6027,46.6695,true,https://www.weather.gov/source/gis/Shapefiles/WSOM/mareas20fe25.txt
LS,LSZ150,091150,Outer Apostle Islands Beyond 5 NM from Mainland,-90.5438,46.9901,true,https://www.weather.gov/source/gis/Shapefiles/WSOM/mareas20fe25.txt
LS,LSZ162,091162,Lake Superior west of a line from Saxon Harbor WI to Grand Portage MN beyond 5NM,-90.5878,47.2964,true,https://www.weather.gov/source/gis/Shapefiles/WSOM/mareas20fe25.txt
LS,LSZ240,091240,Saxon Harbor WI to Black River MI,-90.2524,46.6625,true,https://www.weather.gov/source/gis/Shapefiles/WSOM/mareas20fe25.txt
LS,LSZ241,091241,Black River To Ontonagon MI,-89.7116,46.8413,true,https://www.weather.gov/source/gis/Shapefiles/WSOM/mareas20fe25.txt
LS,LSZ242,091242,Ontonagon to Upper Entrance of Portage Canal MI,-88.9811,47.0902,true,https://www.weather.gov/source/gis/Shapefiles/WSOM/mareas20fe25.txt
LS,LSZ243,091243,Upper Entrance of Portage Canal to Eagle River MI,-88.4734,47.37,true,https://www.weather.gov/source/gis/Shapefiles/WSOM/mareas20fe25.txt
LS,LSZ244,091244,Eagle River to Manitou Island MI,-87.9459,47.4976,true,https://www.weather.gov/source/gis/Shapefiles/WSOM/mareas20fe25.txt
LS,LSZ245,091245,Manitou Island to Point Isabelle MI,-87.7645,47.3576,true,https://www.weather.gov/source/gis/Shapefiles/WSOM/mareas20fe25.txt
LS,LSZ246,091246,Point Isabelle to Lower Entrance of Portage Canal MI,-88.198,47.1424,true,https://www.weather.gov/source/gis/Shapefiles/WSOM/mareas20fe25.txt
LS,LSZ247,091247,Portage Lake to Huron Island MI to Lower Entrance of Portage Canal To Huron Islands MI Including Keweenaw and Huron Bays,-88.232,46.9392,true,https://www.weather.gov/source/gis/Shapefiles/WSOM/mareas20fe25.txt
LS,LSZ248,091248,Huron Islands to Marquette MI,-87.6253,46.8053,true,https://www.weather.gov/source/gis/Shapefiles/WSOM/mareas20fe25.txt
LS,LSZ249,091249,Marquette to Munising MI,-86.9599,46.5385,true,https://www.weather.gov/source/gis/Shapefiles/WSOM/mareas20fe25.txt
LS,LSZ250,091250,Munising to Grand Marais MI,-86.3405,46.6304,true,https://www.weather.gov/source/gis/Shapefiles/WSOM/mareas20fe25.txt
LS,LSZ251,091251,Grand Marais to Whitefish Point MI,-85.4411,46.7575,true,https://www.weather.gov/source/gis/Shapefiles/WSOM/mareas20fe25.txt
LS,LSZ263,091263,Lake Superior from Saxon Harbor WI to Upper Entrance to Portage Canal MI 5NM off shore to the US/Canadian border including Isle Royal National Park,-89.3538,47.4406,true,https://www.weather.gov/source/gis/Shapefiles/WSOM/mareas20fe25.txt
LS,LSZ264,091264,Lake Superior from Upper Entrance to Portage Canal to Manitou Island MI 5NM off shore to the US/Canadian Border,-88.142,47.8327,true,https://www.weather.gov/source/gis/Shapefiles/WSOM/mareas20fe25.txt
LS,LSZ265,091265,Lake Superior West of Line from Manitou Island to Marquette MI Beyond 5NM from shore,-87.6975,47.0699,true,https://www.weather.gov/source/gis/Shapefiles/WSOM/mareas20fe25.txt
LS,LSZ266,091266,Lake Superior East of a line from Manitou Island to Marquette MI and West of a line from Grand Marais MI to the US/Canadian Border Beyond 5NM from shore,-86.8386,47.1877,true,https://www.weather.gov/source/gis/Shapefiles/WSOM/mareas20fe25.txt
LS,LSZ267,091267,Lake Superior from Grand Marais MI to Whitefish Point MI 5NM off shore to the US/Canadian border,-85.5868,46.9822,true,https://www.weather.gov/source/gis/Shapefiles/WSOM/mareas20fe25.txt
LS,LSZ321,091321,Whitefish Bay (U.S. Portion)/Whitefish Point to Point Iroquois MI,-84.8696,46.6002,true,https://www.weather.gov/source/gis/Shapefiles/WSOM/mareas20fe25.txt
LS,LSZ322,091322,St. Marys River Point Iroquois to E. Potagannissing Bay,-84.0149,46.1912,true,https://www.weather.gov/source/gis/Shapefiles/WSOM/mareas20fe25.txt
LM,LMZ043,092043,New Buffalo MI to St Joseph MI,-86.6372,41.9625,true,https://www.weather.gov/source/gis/Shapefiles/WSOM/mareas20fe25.txt
LM,LMZ046,092046,Michigan City IN to New Buffalo MI,-86.8551,41.7936,true,https://www.weather.gov/source/gis/Shapefiles/WSOM/mareas20fe25.txt
LM,LMZ080,092080,Lake Michigan Michigan City IN to St. Joseph MI 5 NM offshore to mid-line of lake.,-86.8137,41.9991,true,https://www.weather.gov/source/gis/Shapefiles/WSOM/mareas20fe25.txt
LM,LMZ221,092221,Green Bay North of line from Cedar River MI to Rock Island Passage,-86.9414,45.6083,true,https://www.weather.gov/source/gis/Shapefiles/WSOM/mareas20fe25.txt
LM,LMZ248,092248,Seul Choix Point to Point Detour MI,-86.2816,45.8093,true,https://www.weather.gov/source/gis/Shapefiles/WSOM/mareas20fe25.txt
LM,LMZ250,092250,5NM East of a line from Fairport MI to Rock Island Passage,-86.6709,45.4935,true,https://www.weather.gov/source/gis/Shapefiles/WSOM/mareas20fe25.txt
LM,LMZ261,092261,Lake Michigan from Seul Choix Point to Rock Island Passage 5NM offshore to Mid Lake,-86.29,45.5912,true,https://www.weather.gov/source/gis/Shapefiles/WSOM/mareas20fe25.txt
LM,LMZ323,092323,Grand Traverse Bay south of a line Grand Traverse Light to Norwood MI,-85.5039,45.0026,true,https://www.weather.gov/source/gis/Shapefiles/WSOM/mareas20fe25.txt
LM,LMZ341,092341,Seul Choix Point to 5NM West of Mackinac Bridge,-85.3832,45.9713,true,https://www.weather.gov/source/gis/Shapefiles/WSOM/mareas20fe25.txt
LM,LMZ342,092342,Norwood MI to 5NM West of Mackinac Bridge including Little Traverse Bay,-85.1479,45.5401,true,https://www.weather.gov/source/gis/Shapefiles/WSOM/mareas20fe25.txt
LM,LMZ344,092344,Sleeping Bear Point to Grand Traverse Light MI,-85.7888,45.084,true,https://www.weather.gov/source/gis/Shapefiles/WSOM/mareas20fe25.txt
LM,LMZ345,092345,Point Betsie to Sleeping Bear Point MI,-86.1283,44.8405,true,https://www.weather.gov/source/gis/Shapefiles/WSOM/mareas20fe25.txt
LM,LMZ346,092346,Manistee to Point Betsie MI,-86.296,44.519,true,https://www.weather.gov/source/gis/Shapefiles/WSOM/mareas20fe25.txt
LM,LMZ362,092362,Lake Michigan South of a line from Seul Choix Point to the Mackinac Bridge and North of a line from Charlevoix MI to South Fox Island 5NM offshore,-85.6119,45.6191,true,https://www.weather.gov/source/gis/Shapefiles/WSOM/mareas20fe25.txt
LM,LMZ364,092364,Lake Michigan from Charlevoix to Point Betsie MI 5NM Offshore to mid lake,-86.2386,45.0391,true,https://www.weather.gov/source/gis/Shapefiles/WSOM/mareas20fe25.txt
LM,LMZ366,092366,Lake Michigan from Point Betsie to Manistee MI 5NM offshore to Mid Lake,-86.6126,44.4722,true,https://www.weather.gov/source/gis/Shapefiles/WSOM/mareas20fe25.txt
LM,LMZ521,092521,Green Bay south of line from Cedar River to Rock Island Passage and north of a line from Oconto WI to Little Sturgeon Bay WI,-87.3849,45.1417,true,https://www.weather.gov/source/gis/Shapefiles/WSOM/mareas20fe25.txt
LM,LMZ522,092522,Green Bay south of line from Oconto WI to Little Sturgeon Bay WI,-87.8374,44.7263,true,https://www.weather.gov/source/gis/Shapefiles/WSOM/mareas20fe25.txt
LM,LMZ541,092541,Rock Island Passage to Sturgeon Bay WI,-87.0044,45.1096,true,https://www.weather.gov/source/gis/Shapefiles/WSOM/mareas20fe25.txt
LM,LMZ542,092542,Sturgeon Bay to Two Rivers WI,-87.4156,44.478,true,https://www.weather.gov/source/gis/Shapefiles/WSOM/mareas20fe25.txt
LM,LMZ543,092543,Two Rivers to Sheboygan WI,-87.6041,44.0385,true,https://www.weather.gov/source/gis/Shapefiles/WSOM/mareas20fe25.txt
LM,LMZ563,092563,Lake Michigan from Rock Island Passage to Sturgeon Bay WI 5NM offshore to mid lake,-86.7506,45.0499,true,https://www.weather.gov/source/gis/Shapefiles/WSOM/mareas20fe25.txt
LM,LMZ565,092565,Lake Michigan from Sturgeon Bay to Two Rivers WI 5NM offshore to Mid Lake,-87.125,44.4666,true,https://www.weather.gov/source/gis/Shapefiles/WSOM/mareas20fe25.txt
LM,LMZ567,092567,Lake Michigan from Two Rivers to Sheboygan WI 5NM offshore to Mid Lake,-87.2805,44.0158,true,https://www.weather.gov/source/gis/Shapefiles/WSOM/mareas20fe25.txt
LM,LMZ643,092643,Sheboygan to Port Washington WI,-87.7158,43.6269,true,https://www.weather.gov/source/gis/Shapefiles/WSOM/mareas20fe25.txt
LM,LMZ644,092644,Port Washington to North Point Light WI,-87.846,43.2113,true,https://www.weather.gov/source/gis/Shapefiles/WSOM/mareas20fe25.txt
LM,LMZ645,092645,North Point Light to Wind Point WI,-87.7898,42.9159,true,https://www.weather.gov/source/gis/Shapefiles/WSOM/mareas20fe25.txt
LM,LMZ646,092646,Wind Point WI to Winthrop Harbor IL,-87.7504,42.6346,true,https://www.weather.gov/source/gis/Shapefiles/WSOM/mareas20fe25.txt
LM,LMZ669,092669,Lake Michigan from Sheboygan to Port Washington WI 5NM offshore to Mid Lake,-87.4084,43.6121,true,https://www.weather.gov/source/gis/Shapefiles/WSOM/mareas20fe25.txt
LM,LMZ671,092671,Lake Michigan from Port Washington to North Point Light WI 5NM offshore to Mid Lake,-87.4569,43.2115,true,https://www.weather.gov/source/gis/Shapefiles/WSOM/mareas20fe25.txt
LM,LMZ673,092673,Lake Michigan from North Point Light to Wind Point WI 5NM offshore to Mid Lake,-87.408,42.922,true,https://www.weather.gov/source/gis/Shapefiles/WSOM/mareas20fe25.txt
LM,LMZ675,092675,Lake Michigan from Wind Point WI to Winthrop Harbor IL 5NM offshore to Mid Lake,-87.3717,42.6209,true,https://www.weather.gov/source/gis/Shapefiles/WSOM/mareas20fe25.txt
LM,LMZ740,092740,Winthrop Harbor to Wilmette Harbor IL,-87.7446,42.2706,true,https://www.weather.gov/source/gis/Shapefiles/WSOM/mareas20fe25.txt
LM,LMZ741,092741,Wilmette Harbor to Northerly Island IL,-87.5985,41.9775,true,https://www.weather.gov/source/gis/Shapefiles/WSOM/mareas20fe25.txt
LM,LMZ742,092742,Northerly Island to Calumet Harbor IL,-87.5267,41.8035,true,https://www.weather.gov/source/gis/Shapefiles/WSOM/mareas20fe25.txt
LM,LMZ743,092743,Calumet Harbor IL to Gary IN,-87.4154,41.7002,true,https://www.weather.gov/source/gis/Shapefiles/WSOM/mareas20fe25.txt
LM,LMZ744,092744,Gary to Burns Harbor IN,-87.2505,41.6639,true,https://www.weather.gov/source/gis/Shapefiles/WSOM/mareas20fe25.txt
LM,LMZ745,092745,Burns Harbor to Michigan City IN,-87.0489,41.7142,true,https://www.weather.gov/source/gis/Shapefiles/WSOM/mareas20fe25.txt
LM,LMZ777,092777,Lake Michigan from Winthrop Harbor to Wilmette Harbor IL 5NM offshore to Mid Lake,-87.3547,42.2925,true,https://www.weather.gov/source/gis/Shapefiles/WSOM/mareas20fe25.txt
LM,LMZ779,092779,Lake Michigan from Wilmette Harbor to Michigan City in 5NM offshore to Mid Lake,-87.249,41.9344,true,https://www.weather.gov/source/gis/Shapefiles/WSOM/mareas20fe25.txt
LM,LMZ844,092844,St Joseph to South Haven MI,-86.4131,42.2652,true,https://www.weather.gov/source/gis/Shapefiles/WSOM/mareas20fe25.txt
LM,LMZ845,092845,South Haven to Holland MI,-86.2738,42.5936,true,https://www.weather.gov/source/gis/Shapefiles/WSOM/mareas20fe25.txt
LM,LMZ846,092846,Holland to Grand Haven MI,-86.2624,42.915,true,https://www.weather.gov/source/gis/Shapefiles/WSOM/mareas20fe25.txt
LM,LMZ847,092847,Grand Haven to Whitehall MI,-86.3898,43.2337,true,https://www.weather.gov/source/gis/Shapefiles/WSOM/mareas20fe25.txt
LM,LMZ848,092848,Whitehall to Pentwater MI,-86.5387,43.6026,true,https://www.weather.gov/source/gis/Shapefiles/WSOM/mareas20fe25.txt
LM,LMZ849,092849,Pentwater to Manistee MI,-86.4861,44.0376,true,https://www.weather.gov/source/gis/Shapefiles/WSOM/mareas20fe25.txt
LM,LMZ868,092868,Lake Michigan from Pentwater to Manistee MI 5NM offshore to Mid Lake,-86.7735,44.0176,true,https://www.weather.gov/source/gis/Shapefiles/WSOM/mareas20fe25.txt
LM,LMZ870,092870,Lake Michigan from Whitehall to Pentwater MI 5NM offshore to Mid Lake,-86.8637,43.5947,true,https://www.weather.gov/source/gis/Shapefiles/WSOM/mareas20fe25.txt
LM,LMZ872,092872,Lake Michigan from Grand Haven to Whitehall MI 5NM offshore to Mid Lake,-86.7736,43.2209,true,https://www.weather.gov/source/gis/Shapefiles/WSOM/mareas20fe25.txt
LM,LMZ874,092874,Lake Michigan from Holland to Grand Haven MI 5NM offshore to Mid Lake,-86.6898,42.9157,true,https://www.weather.gov/source/gis/Shapefiles/WSOM/mareas20fe25.txt
LM,LMZ876,092876,Lake Michigan from South Haven to Holland MI 5NM offshore to Mid lake,-86.6751,42.6143,true,https://www.weather.gov/source/gis/Shapefiles/WSOM/mareas20fe25.txt
LM,LMZ878,092878,Lake Michigan from St Joseph to South Haven MI 5NM offshore to Mid Lake,-86.7191,42.303,true,https://www.weather.gov/source/gis/Shapefiles/WSOM/mareas20fe25.txt
LH,LHZ345,093345,Straits of Mackinac within 5 nm of Mackinac Bridge including Mackinac Island,-84.7074,45.8143,true,https://www.weather.gov/source/gis/Shapefiles/WSOM/mareas20fe25.txt
LH,LHZ346,093346,St Ignace to False Detour Channel,-84.1598,45.9258,true,https://www.weather.gov/source/gis/Shapefiles/WSOM/mareas20fe25.txt
LH,LHZ347,093347,5NM East of Mackinac Bridge to Presque Isle Light MI including Bois Blanc Island,-84.0121,45.5605,true,https://www.weather.gov/source/gis/Shapefiles/WSOM/mareas20fe25.txt
LH,LHZ348,093348,Presque Isle Light to Sturgeon Pt MI Including Thunder Bay National Marine Sanctuary,-83.2967,45.0534,true,https://www.weather.gov/source/gis/Shapefiles/WSOM/mareas20fe25.txt
LH,LHZ349,093349,Sturgeon Pt to Alabaster MI,-83.3287,44.4073,true,https://www.weather.gov/source/gis/Shapefiles/WSOM/mareas20fe25.txt
LH,LHZ361,093361,Lake Huron from 5NM east of Mackinac Bridge to Presque Isle Lt to the US/Canadian border beyond 5 NM from shore,-83.7873,45.6855,true,https://www.weather.gov/source/gis/Shapefiles/WSOM/mareas20fe25.txt
LH,LHZ362,093362,Lake Huron from Presque Isle Lt. to Sturgeon Point MI 5NM off shore to US/Canadian border,-82.8753,45.1132,true,https://www.weather.gov/source/gis/Shapefiles/WSOM/mareas20fe25.txt
LH,LHZ363,093363,Lake Huron from Sturgeon Point to Alabaster MI 5NM off shore to US/Canadian border,-82.7824,44.434,true,https://www.weather.gov/source/gis/Shapefiles/WSOM/mareas20fe25.txt
LH,LHZ421,093421,Outer Saginaw Bay SW of Alabaster to Port Austin MI to Inner Saginaw Bay,-83.3371,44.0553,true,https://www.weather.gov/source/gis/Shapefiles/WSOM/mareas20fe25.txt
LH,LHZ422,093422,Inner Saginaw Bay SW of Point Au Gres to Bay Port MI,-83.6984,43.8041,true,https://www.weather.gov/source/gis/Shapefiles/WSOM/mareas20fe25.txt
